{
  "id": "qq",
  "name": "QQ 本地会话转换器",
  "version": "1.0.0",
  "level": "c",
  "readable_paths": ["%APPDATA%\\Tencent\\QQ"],
  "entry": "qq.wasm",
  "module_sha256": "3f2a9c1d5b7e4088a1c2d3e4f5061728394a5b6c7d8e9f001122334455667788",
  "signature": {
    "algorithm": "ed25519",
    "signer": "aibridge-official-1",
    "value": "6f1d0b2a4c8e7395a0b1c2d3e4f5061728394a5b6c7d8e9f0a1b2c3d4e5f60718899aabbccddeeff00112233445566778899aabbccddeeff0011223344556677"
  }
}
